{
  "application_name": "payments-api",
  "owner": "payments-team@example.com",
  "cost_center": "CC-1042",
  "environment": "sandbox",
  "data_classification": "internal",
  "subscription_id": "00000000-0000-0000-0000-000000000000",
  "management_group_destination": "sandbox",
  "connectivity_profile": "isolated",
  "monthly_budget": 100,
  "budget_start_date": "2026-09-01T00:00:00Z",
  "budget_contact_emails": [
    "payments-team@example.com"
  ],
  "expiration_date": "2027-03-01T00:00:00Z",
  "log_analytics_workspace_id": "/subscriptions/11111111-1111-1111-1111-111111111111/resourceGroups/rg-platform-management/providers/Microsoft.OperationalInsights/workspaces/law-platform",
  "role_assignments": [
    {
      "principal_id": "22222222-2222-2222-2222-222222222222",
      "principal_type": "Group",
      "role_definition_name": "Contributor"
    }
  ],
  "additional_tags": {
    "PortfolioProject": "true"
  }
}
